Fund,Accession_Number
"ALPHASTAR CAPITAL MANAGEMENT, LLC",0001606587-15-000101
"GEOWEALTH MANAGEMENT, LLC",0001085146-15-000848
FRANKFURT-TRUST INVEST LUXEMBOURG AG,0001172661-15-000791
FRANKFURT-TRUST INVESTMENT GESELLSCHAFT MIT BESCHRANKTER HAFTUNG,0001172661-15-000784
FRANKFURT-TRUST INVESTMENT GESELLSCHAFT MIT BESCHRANKTER HAFTUNG,0001172661-15-000783
FRANKFURT-TRUST INVEST LUXEMBOURG AG,0001172661-15-000789
FRANKFURT-TRUST INVEST LUXEMBOURG AG,0001172661-15-000787
FRANKFURT-TRUST INVESTMENT GESELLSCHAFT MIT BESCHRANKTER HAFTUNG,0001172661-15-000785
BHF BANK AKTIENGESELLSCHAFT /ADR/,0001172661-15-000781
BHF BANK AKTIENGESELLSCHAFT /ADR/,0001172661-15-000779
BHF BANK AKTIENGESELLSCHAFT /ADR/,0001172661-15-000778
BHF BANK AKTIENGESELLSCHAFT /ADR/,0001172661-15-000780
HUNTINGTON BANCSHARES INC/MD,0000950123-15-003827
HUNTINGTON BANCSHARES INC/MD,0000950123-15-003824
"AQUAMARINE CAPITAL MANAGEMENT, LLC",0001404599-15-000003
ANALYST PROVIDENT FUNDS LTD.,0001178913-15-000665
FEROX CAPITAL LLP,0001343231-15-000001
"LEBENTHAL WEALTH ADVISORS, LLC",0001221073-15-000039
"LEBENTHAL ASSET MANAGEMENT, LLC",0001221073-15-000038
BTG PACTUAL EUROPE LLP,0001569595-15-000002
BTG PACTUAL ASSET MANAGEMENT US LLC,0001569579-15-000002
BTG PACTUAL ASSET MANAGEMENT S.A. DTVM,0001569785-15-000002
BTG PACTUAL ASIA LTD,0001569580-15-000002
KLEINWORT BENSON INVESTORS INTERNATIONAL LTD.,0001172661-15-000751
KLEINWORT BENSON (CHANNEL ISLANDS) INVESTMENT MANAGEMENT LTD,0001172661-15-000752
KLEINWORT BENSON GROUP LTD,0001172661-15-000750
KLEINWORT BENSON INVESTORS DUBLIN LTD,0001172661-15-000749
KLEINWORT BENSON CHANNEL ISLAND HOLDINGS LTD,0001172661-15-000748
KLEINWORT BENSON INVESTORS INTERNATIONAL LTD.,0001172661-15-000745
KLEINWORT BENSON GROUP LTD,0001172661-15-000744
KLEINWORT BENSON INVESTORS DUBLIN LTD,0001172661-15-000743
HUNTINGTON BANCSHARES INC/MD,0000950123-15-003578
KLEINWORT BENSON (CHANNEL ISLANDS) INVESTMENT MANAGEMENT LTD,0001172661-15-000746
KLEINWORT BENSON (CHANNEL ISLANDS) INVESTMENT MANAGEMENT LTD,0001172661-15-000740
KLEINWORT BENSON INVESTORS DUBLIN LTD,0001172661-15-000737
KLEINWORT BENSON CHANNEL ISLAND HOLDINGS LTD,0001172661-15-000742
KLEINWORT BENSON INVESTORS INTERNATIONAL LTD.,0001172661-15-000739
KLEINWORT BENSON GROUP LTD,0001172661-15-000738
HUNTINGTON BANCSHARES INC/MD,0000950123-15-003576
LEGAL & GENERAL INVESTMENT MANAGEMENT AMERICA INC,0000764068-15-000017
KLEINWORT BENSON CHANNEL ISLAND HOLDINGS LTD,0001172661-15-000736
LEGAL & GENERAL INVESTMENT MANAGEMENT LTD,0000764068-15-000018
HUNTINGTON BANCSHARES INC/MD,0000950123-15-003574
LEGAL & GENERAL INVESTMENT MANAGEMENT LTD,0000764068-15-000019
AERIS CAPITAL MANAGEMENT CO S.A. (LU),0000950123-15-003572
AERIS CAPITAL AG (CH),0000950123-15-003562
"BREVAN HOWARD US INVESTMENT MANAGEMENT, LP",0001140361-15-007935
"BROOKSIDE CAPITAL PARTNERS FUND III, L.P.",0001634445-15-000001
"BROOKSIDE CAPITAL INVESTORS III, L.P.",0001634444-15-000001
CANAAN PARTNERS VIII LLC,0000950123-15-003531
CANAAN PARTNERS VIII LLC,0000950123-15-003526
CANAAN PARTNERS VIII LLC,0000950123-15-003522
CANAAN PARTNERS VIII LLC,0000950123-15-003528
CANAAN EQUITY PARTNERS III LLC,0000950123-15-003518
MILLER GREEN FINANCIAL SERVICES INC /ADV,0001085146-15-000787
"COLUMBIA PACIFIC OPPORTUNITY FUND, L.P.",0001399010-15-000002
"SANKATY MANAGED ACCOUNT INVESTORS, LLC",0001625304-15-000010
BAIN CAPITAL FUND VII LP,0000950123-15-003438
OZ MANAGEMENT II LP,0000950123-15-003367
COLONIAL FIRST STATE ASSET MANAGEMENT (AUSTRALIA) LTD,0001085146-15-000777
VALUE PARTNERS GROUP LTD,0001561602-15-000003
CITADEL ADVISORS II LLC,0000950123-15-003434
NEWQUEST ASIA FUND I (G.P.) LTD.,0000950123-15-003211
"RIKOON GROUP, LLC",0001085146-15-000785
DRAWBRIDGE SPECIAL OPPORTUNITIES ADVISORS LLC,0001085146-15-000755
MEDICAL PROTECTIVE CORP,0000950123-15-003106
FIRST STATE INVESTMENTS (HONG KONG) LTD,0001085146-15-000779
HARBINGER CAPITAL PARTNERS II LP,0000902664-15-001175
ATALAYA LUXCO S.AR.L,0000950123-15-003299
HARBINGER CAPITAL PARTNERS LLC,0000902664-15-001174
SANDERS MORRIS HARRIS INC.,0001085146-15-000783
"SANKATY MANAGED ACCOUNT INVESTORS (TCCC), L.P.",0001625304-15-000011
FIG CORP.,0001085146-15-000752
COLONIAL FIRST STATE INVESTMENTS LTD,0001085146-15-000775
COLONIAL HOLDING CO LTD,0001085146-15-000771
GRATICULE ASIA MACRO ADVISORS LLC,0001085146-15-000759
"BAIN CAPITAL INTEGRAL INVESTORS, LLC",0000950123-15-003321
CONSOLIDATED PRESS INTERNATIONAL HOLDINGS LTD,0000950123-15-003442
CALC III LP,0000950123-15-003423
FORTRESS OPERATING ENTITY I LP,0001085146-15-000753
"SANKATY MANAGED ACCOUNT INVESTORS (NMSIC), L.P.",0001625304-15-000009
FORTRESS MACRO ADVISORS LLC,0001085146-15-000756
"HARBINGER CAPITAL PARTNERS SPECIAL SITUATIONS GP, LLC",0000902664-15-001171
FORTRESS CREDIT OPPORTUNITIES ADVISORS LLC,0001085146-15-000757
CALC IV LP,0000950123-15-003446
COMMONWEALTH INSURANCE HOLDINGS LTD,0001085146-15-000772
GEICO CORP,0000950123-15-003100
ATALAYA LUXCO TOPCO S.C.A.,0000950123-15-003399
"BAIN CAPITAL PARTNERS ASIA II, L.P.",0000950123-15-003134
FECHHEIMER BROTHERS CO,0000950123-15-003090
FIG LLC,0001085146-15-000754
BAIN CAPITAL FUND X LP,0000950123-15-003170
"APOLLO MANAGEMENT, L.P.",0000950123-15-003316
"BAIN CAPITAL EUROPE FUND III, L.P.",0000950123-15-003192
NEBRASKA FURNITURE MART,0000950123-15-003086
"ESL INVESTMENTS, INC.",0000950123-15-003283
COMMONWEALTH BANK OFFICERS SUPERANNUATION CORP PTY LTD,0001085146-15-000781
FIRST STATE INVESTMENT MANAGEMENT UK LTD,0001085146-15-000778
BERKSHIRE HATHAWAY LIFE INSURANCE CO OF NEBRASKA,0000950123-15-003094
"SANKATY MANAGED ACCOUNT (TCCC), L.P.",0001625304-15-000012
BH FINANCE LLC,0000950123-15-003077
COLONIAL FIRST STATE GROUP LTD,0001085146-15-000773
REALINDEX INVESTMENTS PTY LTD,0001085146-15-000776
INTECH INVESTMENT MANAGEMENT LLC,0000812295-15-000022
GSO CAPITAL PARTNERS LP,0000950123-15-003449
SMH CAPITAL ADVISORS INC,0001085146-15-000784
"APOLLO CAPITAL MANAGEMENT, L.P.",0000950123-15-003309
FIRST STATE INVESTMENTS INTERNATIONAL LTD,0001085146-15-000780
FORTRESS CREDIT OPPORTUNITIES III ADVISORS LLC,0001085146-15-000758
CAPITAL 121 PTY LTD,0001085146-15-000774
ATALAYA PIKCO S.AR.L.,0000950123-15-003276
BAIN CAPITAL PARTNERS VII LP,0000950123-15-003190
COHEN & STEERS UK LTD,0001140361-15-007573
COHEN & STEERS CAPITAL MANAGEMENT INC,0001140361-15-007565
CYPRESS INSURANCE CO,0000950123-15-003057
PALISADES SAFETY & INSURANCE ASSOCIATION,0001140361-15-007578
PLYMOUTH ROCK CO INC,0001140361-15-007569
"CHC PARTNERS, L.L.C.",0000950123-15-003063
"SANKATY CREDIT OPPORTUNITIES INVESTORS V-B, L.P.",0001625304-15-000003
BERKSHIRE HATHAWAY HOMESTATE INSURANCE CO.,0000950123-15-003033
"LSF8 GYPSUM HOLDINGS, L.P.",0001138420-15-000003
"SANKATY CREDIT OPPORTUNITIES V-B, L.P.",0001625304-15-000004
"ROBOTTI & CO ADVISORS, LLC",0001512948-15-000001
"SANKATY MANAGED ACCOUNT (PSERS), L.P.",0001625319-15-000001
"SANKATY RIO GRANDE FMC, L.P.",0001625304-15-000005
"CENTERBRIDGE SPECIAL CREDIT ADVISORS II, L.L.C",0000902664-15-001123
KKR INVESTMENT MANAGEMENT LLC,0001104659-15-011326
"SANKATY CREDIT OPPORTUNITIES INVESTORS V-A2, L.P.",0001625304-15-000001
ARONSON JEFFREY,0000902664-15-001124
"CENTERBRIDGE PARTNERS HOLDINGS, LLC",0000902664-15-001120
"CENTERBRIDGE CREDIT ADVISORS, L.L.C.",0000902664-15-001131
"SANKATY HIGH INCOME INVESTORS, L.P.",0001625325-15-000001
USAA INVESTMENT MANAGEMENT CO,0001140361-15-007543
USAA INVESTMENT CORP,0001140361-15-007538
KKR CREDIT ADVISORS (US) LLC,0001104659-15-011325
LINCOLN INVESTMENT ADVISORS CORP,0001085146-15-000747
HUNTINGTON BANCSHARES INC/MD,0000950123-15-003019
"LOOMIS SAYLES TRUST COMPANY, LLC",0001435066-15-000002
USAA CAPITAL CORP,0001140361-15-007536
USAA ASSET MANAGEMENT CO,0001140361-15-007528
"CENTERBRIDGE ADVISORS, LLC",0000902664-15-001126
"SANKATY CREDIT OPPORTUNITIES V-A2, L.P.",0001625304-15-000002
GALLOGLY MARK T,0000902664-15-001128
"CENTERBRIDGE SPECIAL CREDIT ADVISORS, L.L.C.",0000902664-15-001135
U.S. INVESTMENT CORP,0000950123-15-003002
SAN FRANCISCO PARTNERS LP,0001140361-15-007492
"SANKATY CREDIT OPPORTUNITIES V AIV I, L.P.",0001485337-15-000005
"SANKATY HIGH INCOME PARTNERSHIP, L.P.",0001517258-15-000001
"SANKATY CREDIT OPPORTUNITIES V-A, L.P.",0001485337-15-000006
BUFFETT WARREN E,0000950123-15-003010
"ENGAGED CAPITAL HOLDINGS, LLC",0000921895-15-000459
WESTWOOD MANAGEMENT CORP /TX,0000950123-15-003000
"LONE STAR MANAGEMENT CO. VIII, LTD.",0001138420-15-000002
PAULSON MANAGEMENT LP,0001140361-15-007475
WELLING GLENN W.,0000921895-15-000460
SPO PARTNERS II LP,0001140361-15-007483
WESTWOOD INTERNATIONAL ADVISORS INC.,0000950123-15-002996
MILLENNIUM GLOBAL ESTATE GP LLC,0001426818-15-000001
"D. E. SHAW ADVISER, L.L.C.",0001144204-15-010290
COLUMBIA INSURANCE CO,0000950123-15-002987
"LION FUND, L.P.",0000921895-15-000454
COHEN ARA,0001012975-15-000140
WAGNER THOMAS,0001012975-15-000139
MILLENNIUM INTERNATIONAL MANAGEMENT LP,0001426821-15-000002
FIRST COMMONWEALTH BANK,0001362556-15-000002
"ELLIOTT INTERNATIONAL, L.P.",0001140361-15-007456
"ABRAMS BISON PARTNERS, LP",0000919574-15-002287
